=== 命令 ===
python /root/project5/main.py --text_dim 512 --image_dim 512 --dropout 0.25 --learning_rate 1e-05 --feature_fusion combine --name combine_textdim512_dropout0.25_lr1e-05 --wandb True

=== 标准输出 ===
Config Info:
device: cuda
batch_size: 32
learning_rate: 1e-05
num_epochs: 30
val_ratio: 0.2
wandb: True
early_stop_patience: 3
text_model_name: ./pretrained_models/bert-base-uncased
image_model_name: ./pretrained_models/swinv2-base
data_dir: data
train_file: train.txt
test_file: test_without_label.txt
result_file: result.txt
use_kfold: False
k_folds: 5
project_name: multimodal_sentiment_analysis_fusion
use_text: True
use_image: True
feature_fusion: combine
num_classes: 3
log_iteration: 10
name: combine_textdim512_dropout0.25_lr1e-05
text_dim: 512
image_dim: 512
dropout: 0.25
loss_type: focal
alpha: 0.25
beta: 0.75
neural_init_weight: 1.5

数集统计信:
总样本数: 6869
始样本数: 4000
强样本数: 2869

标签分布:
negative: 2386 (34.74%)
neutral: 2095 (30.50%)
positive: 2388 (34.76%)

缺失文本数: 0
缺失图数: 0
Training on cuda

类别准确:
positive: 0.6916 (323/467)
neutral: 0.4819 (40/83)
negative: 0.5840 (146/250)

Epoch 1/30
Train Loss: 0.6809, Train Acc: 0.5899
Val Loss: 0.8197, Val Acc: 0.6362

类别准确:
positive: 0.6488 (303/467)
neutral: 0.5181 (43/83)
negative: 0.6840 (171/250)

Epoch 2/30
Train Loss: 0.5219, Train Acc: 0.7030
Val Loss: 0.7716, Val Acc: 0.6462

类别准确:
positive: 0.7345 (343/467)
neutral: 0.4699 (39/83)
negative: 0.6840 (171/250)

Epoch 3/30
Train Loss: 0.3475, Train Acc: 0.8061
Val Loss: 0.7231, Val Acc: 0.6913

类别准确:
positive: 0.8030 (375/467)
neutral: 0.4337 (36/83)
negative: 0.6120 (153/250)

Epoch 4/30
Train Loss: 0.2574, Train Acc: 0.8828
Val Loss: 0.7409, Val Acc: 0.7050

类别准确:
positive: 0.7602 (355/467)
neutral: 0.3735 (31/83)
negative: 0.6920 (173/250)

Epoch 5/30
Train Loss: 0.2159, Train Acc: 0.9253
Val Loss: 0.7551, Val Acc: 0.6987

类别准确:
positive: 0.7794 (364/467)
neutral: 0.3253 (27/83)
negative: 0.7080 (177/250)

Epoch 6/30
Train Loss: 0.1699, Train Acc: 0.9616
Val Loss: 0.7639, Val Acc: 0.7100

类别准确:
positive: 0.8330 (389/467)
neutral: 0.3012 (25/83)
negative: 0.6400 (160/250)

Epoch 7/30
Train Loss: 0.1416, Train Acc: 0.9859
Val Loss: 0.8312, Val Acc: 0.7175

类别准确:
positive: 0.8522 (398/467)
neutral: 0.2771 (23/83)
negative: 0.6200 (155/250)

Epoch 8/30
Train Loss: 0.1596, Train Acc: 0.9657
Val Loss: 0.8487, Val Acc: 0.7200

类别准确:
positive: 0.7880 (368/467)
neutral: 0.3614 (30/83)
negative: 0.6520 (163/250)

Epoch 9/30
Train Loss: 0.1325, Train Acc: 0.9899
Val Loss: 0.9084, Val Acc: 0.7013

类别准确:
positive: 0.8287 (387/467)
neutral: 0.2892 (24/83)
negative: 0.6520 (163/250)

Epoch 10/30
Train Loss: 0.1377, Train Acc: 0.9818
Val Loss: 0.9207, Val Acc: 0.7175

类别准确:
positive: 0.8094 (378/467)
neutral: 0.3253 (27/83)
negative: 0.6760 (169/250)

Epoch 11/30
Train Loss: 0.1256, Train Acc: 0.9899
Val Loss: 0.9207, Val Acc: 0.7175
Early stopping triggered!
Best validation accuracy: 0.7200

=== wandb 日志 ===
/root/miniconda3/lib/python3.12/site-packages/torch/nn/modules/transformer.py:379: UserWarning: enable_nested_tensor is True, but self.use_nested_tensor is False because encoder_layer.self_attn.batch_first was not True(use batch_first for better inference performance)
  warnings.warn(
/root/miniconda3/lib/python3.12/site-packages/torch/optim/lr_scheduler.py:62: UserWarning: The verbose parameter is deprecated. Please use get_last_lr() to access the learning rate.
  warnings.warn(
wandb: Using wandb-core as the SDK backend.  Please refer to https://wandb.me/wandb-core for more information.
wandb: Currently logged in as: leofyfan (leofyfan-east-china-normal-university). Use `wandb login --relogin` to force relogin
wandb: Tracking run with wandb version 0.19.1
wandb: Run data is saved locally in /root/project5/wandb/run-20250119_052345-goh223r8
wandb: Run `wandb offline` to turn off syncing.
wandb: Syncing run combine_textdim512_dropout0.25_lr1e-05_Multimodal_iterations_20250119_052344
wandb: ⭐️ View project at https://wandb.ai/leofyfan-east-china-normal-university/multimodal_sentiment_analysis_fusion
wandb: 🚀 View run at https://wandb.ai/leofyfan-east-china-normal-university/multimodal_sentiment_analysis_fusion/runs/goh223r8
wandb: uploading wandb-summary.json; uploading config.yaml; uploading output.log
wandb:                                                                                
wandb: 
wandb: Run history:
wandb:  iteration ▁▁▁▁▂▂▂▂▂▂▂▃▃▃▃▄▅▅▅▅▅▅▅▅▆▆▆▆▆▆▆▆▇▇▇█████
wandb:  train_acc ▁▁▂▁▄▄▂▄▅▆▇▅██▇▇▆█▇██████▇█████▇█▇██████
wandb: train_loss ██▆▆▅▆▄▅▄▄▄▃▃▃▃▁▂▂▂▁▁▁▁▁▁▁▁▁▁▁▁▁▁▁▁▁▁▂▁▁
wandb: 
wandb: Run summary:
wandb:  iteration 1890
wandb:  train_acc 1
wandb: train_loss 0.11593
wandb: 
wandb: 🚀 View run combine_textdim512_dropout0.25_lr1e-05_Multimodal_iterations_20250119_052344 at: https://wandb.ai/leofyfan-east-china-normal-university/multimodal_sentiment_analysis_fusion/runs/goh223r8
wandb: ⭐️ View project at: https://wandb.ai/leofyfan-east-china-normal-university/multimodal_sentiment_analysis_fusion
wandb: Synced 5 W&B file(s), 0 media file(s), 0 artifact file(s) and 0 other file(s)
wandb: Find logs at: ./wandb/run-20250119_052345-goh223r8/logs
wandb: Tracking run with wandb version 0.19.1
wandb: Run data is saved locally in /root/project5/wandb/run-20250119_053753-zkf2q4xf
wandb: Run `wandb offline` to turn off syncing.
wandb: Syncing run combine_textdim512_dropout0.25_lr1e-05_Multimodal_epochs_20250119_053753
wandb: ⭐️ View project at https://wandb.ai/leofyfan-east-china-normal-university/multimodal_sentiment_analysis_fusion
wandb: 🚀 View run at https://wandb.ai/leofyfan-east-china-normal-university/multimodal_sentiment_analysis_fusion/runs/zkf2q4xf
wandb: uploading history steps 0-0, summary; uploading wandb-metadata.json; uploading wandb-summary.json
wandb:                                                                                
wandb: 
wandb: Run history:
wandb:      epoch ▁▂▂▃▄▅▅▆▇▇█
wandb:  train_acc ▁▃▅▆▇██████
wandb: train_loss █▆▄▃▂▂▁▁▁▁▁
wandb:    val_acc ▁▂▆▇▆▇██▆██
wandb:   val_loss ▄▃▁▂▂▂▅▅███
wandb: 
wandb: Run summary:
wandb:      epoch 11
wandb:  train_acc 0.9899
wandb: train_loss 0.12557
wandb:    val_acc 0.7175
wandb:   val_loss 0.92071
wandb: 
wandb: 🚀 View run combine_textdim512_dropout0.25_lr1e-05_Multimodal_epochs_20250119_053753 at: https://wandb.ai/leofyfan-east-china-normal-university/multimodal_sentiment_analysis_fusion/runs/zkf2q4xf
wandb: ⭐️ View project at: https://wandb.ai/leofyfan-east-china-normal-university/multimodal_sentiment_analysis_fusion
wandb: Synced 5 W&B file(s), 0 media file(s), 0 artifact file(s) and 0 other file(s)
wandb: Find logs at: ./wandb/run-20250119_053753-zkf2q4xf/logs

