=== 命令 ===
python /root/project5/main.py --text_dim 512 --image_dim 256 --dropout 0.1 --learning_rate 5e-06 --feature_fusion attention_concat --name attention_concat_textdim512_imagedim256_dropout0.1_lr5e-06 --wandb True

=== 标准输出 ===
Config Info:
device: cuda
batch_size: 32
learning_rate: 5e-06
num_epochs: 30
val_ratio: 0.2
wandb: True
early_stop_patience: 3
text_model_name: ./pretrained_models/bert-base-uncased
image_model_name: ./pretrained_models/swinv2-base
data_dir: data
train_file: train.txt
test_file: test_without_label.txt
result_file: result.txt
use_kfold: False
k_folds: 5
project_name: multimodal_sentiment_analysis_fusion
use_text: True
use_image: True
feature_fusion: attention_concat
num_classes: 3
log_iteration: 10
name: attention_concat_textdim512_imagedim256_dropout0.1_lr5e-06
text_dim: 512
image_dim: 256
dropout: 0.1
loss_type: focal
alpha: 0.25
beta: 0.75
neural_init_weight: 1.5

数集统计信:
总样本数: 6869
始样本数: 4000
强样本数: 2869

标签分布:
negative: 2386 (34.74%)
neutral: 2095 (30.50%)
positive: 2388 (34.76%)

缺失文本数: 0
缺失图数: 0
Training on cuda

类别准确:
positive: 0.8501 (397/467)
neutral: 0.3494 (29/83)
negative: 0.2720 (68/250)

Epoch 1/30
Train Loss: 0.7456, Train Acc: 0.4970
Val Loss: 0.8638, Val Acc: 0.6175

类别准确:
positive: 0.7409 (346/467)
neutral: 0.3735 (31/83)
negative: 0.6240 (156/250)

Epoch 2/30
Train Loss: 0.5960, Train Acc: 0.6202
Val Loss: 0.7612, Val Acc: 0.6663

类别准确:
positive: 0.7152 (334/467)
neutral: 0.4217 (35/83)
negative: 0.6840 (171/250)

Epoch 3/30
Train Loss: 0.5014, Train Acc: 0.6788
Val Loss: 0.7229, Val Acc: 0.6750

类别准确:
positive: 0.7045 (329/467)
neutral: 0.4217 (35/83)
negative: 0.6960 (174/250)

Epoch 4/30
Train Loss: 0.3900, Train Acc: 0.8040
Val Loss: 0.7222, Val Acc: 0.6725

类别准确:
positive: 0.7259 (339/467)
neutral: 0.4217 (35/83)
negative: 0.7200 (180/250)

Epoch 5/30
Train Loss: 0.3566, Train Acc: 0.8081
Val Loss: 0.7111, Val Acc: 0.6925

类别准确:
positive: 0.6981 (326/467)
neutral: 0.3735 (31/83)
negative: 0.7560 (189/250)

Epoch 6/30
Train Loss: 0.2790, Train Acc: 0.8768
Val Loss: 0.7324, Val Acc: 0.6825

类别准确:
positive: 0.8116 (379/467)
neutral: 0.3855 (32/83)
negative: 0.6400 (160/250)

Epoch 7/30
Train Loss: 0.2191, Train Acc: 0.9374
Val Loss: 0.7299, Val Acc: 0.7137

类别准确:
positive: 0.8030 (375/467)
neutral: 0.3976 (33/83)
negative: 0.6560 (164/250)

Epoch 8/30
Train Loss: 0.1930, Train Acc: 0.9374
Val Loss: 0.7505, Val Acc: 0.7150

类别准确:
positive: 0.7131 (333/467)
neutral: 0.3614 (30/83)
negative: 0.7320 (183/250)

Epoch 9/30
Train Loss: 0.1817, Train Acc: 0.9475
Val Loss: 0.8167, Val Acc: 0.6825

类别准确:
positive: 0.7816 (365/467)
neutral: 0.3614 (30/83)
negative: 0.6920 (173/250)

Epoch 10/30
Train Loss: 0.1739, Train Acc: 0.9556
Val Loss: 0.8100, Val Acc: 0.7100

类别准确:
positive: 0.8030 (375/467)
neutral: 0.3855 (32/83)
negative: 0.6240 (156/250)

Epoch 11/30
Train Loss: 0.1622, Train Acc: 0.9657
Val Loss: 0.8154, Val Acc: 0.7037
Early stopping triggered!
Best validation accuracy: 0.7150

=== wandb 日志 ===
/root/miniconda3/lib/python3.12/site-packages/torch/nn/modules/transformer.py:379: UserWarning: enable_nested_tensor is True, but self.use_nested_tensor is False because encoder_layer.self_attn.batch_first was not True(use batch_first for better inference performance)
  warnings.warn(
/root/miniconda3/lib/python3.12/site-packages/torch/optim/lr_scheduler.py:62: UserWarning: The verbose parameter is deprecated. Please use get_last_lr() to access the learning rate.
  warnings.warn(
wandb: Using wandb-core as the SDK backend.  Please refer to https://wandb.me/wandb-core for more information.
wandb: Currently logged in as: leofyfan (leofyfan-east-china-normal-university). Use `wandb login --relogin` to force relogin
wandb: Tracking run with wandb version 0.19.1
wandb: Run data is saved locally in /root/project5/wandb/run-20250119_145921-3p8mdjhu
wandb: Run `wandb offline` to turn off syncing.
wandb: Syncing run attention_concat_textdim512_imagedim256_dropout0.1_lr5e-06_Multimodal_iterations_20250119_145920
wandb: ⭐️ View project at https://wandb.ai/leofyfan-east-china-normal-university/multimodal_sentiment_analysis_fusion
wandb: 🚀 View run at https://wandb.ai/leofyfan-east-china-normal-university/multimodal_sentiment_analysis_fusion/runs/3p8mdjhu
wandb: uploading history steps 189-191, summary; uploading wandb-summary.json; uploading config.yaml; uploading output.log
wandb: uploading history steps 189-191, summary
wandb:                                                                                
wandb: 
wandb: Run history:
wandb:  iteration ▁▁▂▂▂▂▂▂▂▃▃▃▃▃▃▄▄▄▄▄▄▄▅▅▅▅▅▆▆▆▆▆▆▇▇▇▇███
wandb:  train_acc ▂▁▃▃▄▃▃▅▆▆▅▆▆▆▆▆▇▆▇▆▇▇▇▇██▇▇▇▇▇█▇▇███▇██
wandb: train_loss █▇▇▆▇▅▆▅▄▄▄▄▅▃▄▅▅▃▂▃▃▃▂▃▂▂▁▁▂▁▁▁▂▁▁▁▁▁▂▂
wandb: 
wandb: Run summary:
wandb:  iteration 1890
wandb:  train_acc 0.9375
wandb: train_loss 0.19257
wandb: 
wandb: 🚀 View run attention_concat_textdim512_imagedim256_dropout0.1_lr5e-06_Multimodal_iterations_20250119_145920 at: https://wandb.ai/leofyfan-east-china-normal-university/multimodal_sentiment_analysis_fusion/runs/3p8mdjhu
wandb: ⭐️ View project at: https://wandb.ai/leofyfan-east-china-normal-university/multimodal_sentiment_analysis_fusion
wandb: Synced 5 W&B file(s), 0 media file(s), 0 artifact file(s) and 0 other file(s)
wandb: Find logs at: ./wandb/run-20250119_145921-3p8mdjhu/logs
wandb: Tracking run with wandb version 0.19.1
wandb: Run data is saved locally in /root/project5/wandb/run-20250119_151529-maq83g6r
wandb: Run `wandb offline` to turn off syncing.
wandb: Syncing run attention_concat_textdim512_imagedim256_dropout0.1_lr5e-06_Multimodal_epochs_20250119_151529
wandb: ⭐️ View project at https://wandb.ai/leofyfan-east-china-normal-university/multimodal_sentiment_analysis_fusion
wandb: 🚀 View run at https://wandb.ai/leofyfan-east-china-normal-university/multimodal_sentiment_analysis_fusion/runs/maq83g6r
wandb: uploading summary; uploading wandb-summary.json
wandb:                                                                                
wandb: 
wandb: Run history:
wandb:      epoch ▁▂▂▃▄▅▅▆▇▇█
wandb:  train_acc ▁▃▄▆▆▇█████
wandb: train_loss █▆▅▄▃▂▂▁▁▁▁
wandb:    val_acc ▁▅▅▅▆▆██▆█▇
wandb:   val_loss █▃▂▂▁▂▂▃▆▆▆
wandb: 
wandb: Run summary:
wandb:      epoch 11
wandb:  train_acc 0.96566
wandb: train_loss 0.16217
wandb:    val_acc 0.70375
wandb:   val_loss 0.81538
wandb: 
wandb: 🚀 View run attention_concat_textdim512_imagedim256_dropout0.1_lr5e-06_Multimodal_epochs_20250119_151529 at: https://wandb.ai/leofyfan-east-china-normal-university/multimodal_sentiment_analysis_fusion/runs/maq83g6r
wandb: ⭐️ View project at: https://wandb.ai/leofyfan-east-china-normal-university/multimodal_sentiment_analysis_fusion
wandb: Synced 5 W&B file(s), 0 media file(s), 0 artifact file(s) and 0 other file(s)
wandb: Find logs at: ./wandb/run-20250119_151529-maq83g6r/logs

