=== 命令 ===
python /root/project5/main.py --text_dim 256 --image_dim 512 --dropout 0.2 --learning_rate 5e-06 --feature_fusion attention_concat --name attention_concat_textdim256_imagedim512_dropout0.2_lr5e-06 --wandb True

=== 标准输出 ===
Config Info:
device: cuda
batch_size: 32
learning_rate: 5e-06
num_epochs: 30
val_ratio: 0.2
wandb: True
early_stop_patience: 3
text_model_name: ./pretrained_models/bert-base-uncased
image_model_name: ./pretrained_models/swinv2-base
data_dir: data
train_file: train.txt
test_file: test_without_label.txt
result_file: result.txt
use_kfold: False
k_folds: 5
project_name: multimodal_sentiment_analysis_fusion
use_text: True
use_image: True
feature_fusion: attention_concat
num_classes: 3
log_iteration: 10
name: attention_concat_textdim256_imagedim512_dropout0.2_lr5e-06
text_dim: 256
image_dim: 512
dropout: 0.2
loss_type: focal
alpha: 0.25
beta: 0.75
neural_init_weight: 1.5

数集统计信:
总样本数: 6869
始样本数: 4000
强样本数: 2869

标签分布:
negative: 2386 (34.74%)
neutral: 2095 (30.50%)
positive: 2388 (34.76%)

缺失文本数: 0
缺失图数: 0
Training on cuda

类别准确:
positive: 0.5161 (241/467)
neutral: 0.4819 (40/83)
negative: 0.6120 (153/250)

Epoch 1/30
Train Loss: 0.7669, Train Acc: 0.5091
Val Loss: 0.9821, Val Acc: 0.5425

类别准确:
positive: 0.5974 (279/467)
neutral: 0.5060 (42/83)
negative: 0.6120 (153/250)

Epoch 2/30
Train Loss: 0.5929, Train Acc: 0.6545
Val Loss: 0.8584, Val Acc: 0.5925

类别准确:
positive: 0.6231 (291/467)
neutral: 0.5181 (43/83)
negative: 0.7040 (176/250)

Epoch 3/30
Train Loss: 0.5144, Train Acc: 0.7010
Val Loss: 0.8135, Val Acc: 0.6375

类别准确:
positive: 0.6981 (326/467)
neutral: 0.4337 (36/83)
negative: 0.7080 (177/250)

Epoch 4/30
Train Loss: 0.4486, Train Acc: 0.7394
Val Loss: 0.7582, Val Acc: 0.6737

类别准确:
positive: 0.6702 (313/467)
neutral: 0.4819 (40/83)
negative: 0.6880 (172/250)

Epoch 5/30
Train Loss: 0.3383, Train Acc: 0.8222
Val Loss: 0.7759, Val Acc: 0.6562

类别准确:
positive: 0.7045 (329/467)
neutral: 0.3976 (33/83)
negative: 0.7360 (184/250)

Epoch 6/30
Train Loss: 0.3249, Train Acc: 0.8343
Val Loss: 0.7645, Val Acc: 0.6825

类别准确:
positive: 0.7409 (346/467)
neutral: 0.3614 (30/83)
negative: 0.6800 (170/250)

Epoch 7/30
Train Loss: 0.2710, Train Acc: 0.8889
Val Loss: 0.7608, Val Acc: 0.6825

类别准确:
positive: 0.7901 (369/467)
neutral: 0.3855 (32/83)
negative: 0.5840 (146/250)

Epoch 8/30
Train Loss: 0.2192, Train Acc: 0.9192
Val Loss: 0.7972, Val Acc: 0.6837

类别准确:
positive: 0.8051 (376/467)
neutral: 0.3373 (28/83)
negative: 0.6200 (155/250)

Epoch 9/30
Train Loss: 0.1936, Train Acc: 0.9313
Val Loss: 0.8197, Val Acc: 0.6987

类别准确:
positive: 0.7473 (349/467)
neutral: 0.3133 (26/83)
negative: 0.6920 (173/250)

Epoch 10/30
Train Loss: 0.1810, Train Acc: 0.9556
Val Loss: 0.8529, Val Acc: 0.6850

类别准确:
positive: 0.7880 (368/467)
neutral: 0.3614 (30/83)
negative: 0.6280 (157/250)

Epoch 11/30
Train Loss: 0.1629, Train Acc: 0.9636
Val Loss: 0.8870, Val Acc: 0.6937

类别准确:
positive: 0.8073 (377/467)
neutral: 0.3012 (25/83)
negative: 0.6240 (156/250)

Epoch 12/30
Train Loss: 0.1615, Train Acc: 0.9758
Val Loss: 0.8651, Val Acc: 0.6975
Early stopping triggered!
Best validation accuracy: 0.6987

=== wandb 日志 ===
/root/miniconda3/lib/python3.12/site-packages/torch/nn/modules/transformer.py:379: UserWarning: enable_nested_tensor is True, but self.use_nested_tensor is False because encoder_layer.self_attn.batch_first was not True(use batch_first for better inference performance)
  warnings.warn(
/root/miniconda3/lib/python3.12/site-packages/torch/optim/lr_scheduler.py:62: UserWarning: The verbose parameter is deprecated. Please use get_last_lr() to access the learning rate.
  warnings.warn(
wandb: Using wandb-core as the SDK backend.  Please refer to https://wandb.me/wandb-core for more information.
wandb: Currently logged in as: leofyfan (leofyfan-east-china-normal-university). Use `wandb login --relogin` to force relogin
wandb: Tracking run with wandb version 0.19.1
wandb: Run data is saved locally in /root/project5/wandb/run-20250119_133641-kfhhntg0
wandb: Run `wandb offline` to turn off syncing.
wandb: Syncing run attention_concat_textdim256_imagedim512_dropout0.2_lr5e-06_Multimodal_iterations_20250119_133640
wandb: ⭐️ View project at https://wandb.ai/leofyfan-east-china-normal-university/multimodal_sentiment_analysis_fusion
wandb: 🚀 View run at https://wandb.ai/leofyfan-east-china-normal-university/multimodal_sentiment_analysis_fusion/runs/kfhhntg0
wandb: uploading wandb-summary.json; uploading config.yaml; uploading output.log
wandb:                                                                                
wandb: 
wandb: Run history:
wandb:  iteration ▁▁▁▁▂▂▂▂▃▃▃▃▃▃▃▄▄▄▄▄▅▅▅▅▅▅▅▅▆▆▆▆▇▇▇▇▇███
wandb:  train_acc ▁▂▂▃▂▅▃▆▅▆▆▄▅▆▅▇▇▆▆▆▇▆▅▇▇█▇▆█▇█▇▇█▇█▇███
wandb: train_loss ▇▇█▇▅▅▅▄▄▃▃▄▃▄▃▄▄▃▄▂▂▂▂▃▄▂▂▂▂▂▂▃▁▁▁▁▁▁▂▁
wandb: 
wandb: Run summary:
wandb:  iteration 2062
wandb:  train_acc 1
wandb: train_loss 0.13527
wandb: 
wandb: 🚀 View run attention_concat_textdim256_imagedim512_dropout0.2_lr5e-06_Multimodal_iterations_20250119_133640 at: https://wandb.ai/leofyfan-east-china-normal-university/multimodal_sentiment_analysis_fusion/runs/kfhhntg0
wandb: ⭐️ View project at: https://wandb.ai/leofyfan-east-china-normal-university/multimodal_sentiment_analysis_fusion
wandb: Synced 5 W&B file(s), 0 media file(s), 0 artifact file(s) and 0 other file(s)
wandb: Find logs at: ./wandb/run-20250119_133641-kfhhntg0/logs
wandb: Tracking run with wandb version 0.19.1
wandb: Run data is saved locally in /root/project5/wandb/run-20250119_135320-dpgc9qxk
wandb: Run `wandb offline` to turn off syncing.
wandb: Syncing run attention_concat_textdim256_imagedim512_dropout0.2_lr5e-06_Multimodal_epochs_20250119_135320
wandb: ⭐️ View project at https://wandb.ai/leofyfan-east-china-normal-university/multimodal_sentiment_analysis_fusion
wandb: 🚀 View run at https://wandb.ai/leofyfan-east-china-normal-university/multimodal_sentiment_analysis_fusion/runs/dpgc9qxk
wandb: uploading history steps 0-0, summary; uploading wandb-summary.json; uploading wandb-metadata.json
wandb:                                                                                
wandb: 
wandb: Run history:
wandb:      epoch ▁▂▂▃▄▄▅▅▆▇▇█
wandb:  train_acc ▁▃▄▄▆▆▇▇▇███
wandb: train_loss █▆▅▄▃▃▂▂▁▁▁▁
wandb:    val_acc ▁▃▅▇▆▇▇▇█▇██
wandb:   val_loss █▄▃▁▂▁▁▂▃▄▅▄
wandb: 
wandb: Run summary:
wandb:      epoch 12
wandb:  train_acc 0.97576
wandb: train_loss 0.16152
wandb:    val_acc 0.6975
wandb:   val_loss 0.8651
wandb: 
wandb: 🚀 View run attention_concat_textdim256_imagedim512_dropout0.2_lr5e-06_Multimodal_epochs_20250119_135320 at: https://wandb.ai/leofyfan-east-china-normal-university/multimodal_sentiment_analysis_fusion/runs/dpgc9qxk
wandb: ⭐️ View project at: https://wandb.ai/leofyfan-east-china-normal-university/multimodal_sentiment_analysis_fusion
wandb: Synced 5 W&B file(s), 0 media file(s), 0 artifact file(s) and 0 other file(s)
wandb: Find logs at: ./wandb/run-20250119_135320-dpgc9qxk/logs

